<?xml version="1.0" encoding="UTF-8"?>
<!DOCTYPE File_Root SYSTEM "http://echo1.bluequartz.net/viewvc/CTMD/MXADataModel/Resources/XML/mxa_0.4.dtd">
<File_Root>
  <Data_Model Model_Type="MXA" Model_Version="0.4">
    <Data_Root Name="DataModelTest/Data/Root/Is/Here/" />
    <Data_Dimensions>
        <Dimension Alt_Name="Vol Frac" Count="16" End_Value="50" Increment="2" Index="0" Name="Dim_0" Start_Value="20" Uniform="1" />
        <Dimension Alt_Name="Rnd Seed" Count="9" End_Value="5000" Increment="500" Index="1" Name="Dim_1" Start_Value="1000" Uniform="1" />
        <Dimension Alt_Name="TS" Count="100" End_Value="99" Increment="1" Index="2" Name="Dim_2" Start_Value="0" Uniform="1" />
        <Dimension Alt_Name="slice" Count="256" End_Value="255" Increment="1" Index="3" Name="Dim_3" Start_Value="0" Uniform="1" />
    </Data_Dimensions>
    <Data_Records>
        <Signal Alt_Name="Record 0" Name="Record 0" />
    </Data_Records>
  </Data_Model>
  <Meta_Data>
    <Required_MD Creator="Mike Jackson" 
    Date="June 25 2007" 
    Description="Some description of your experiment or data set" 
    Distribution_Rights="Unlimited" 
    Name="Test Data" 
    Original_Source_File="Description of where the data comes from: Directly from the Instrument or from files on disk." 
    Pedigree="Original" 
    Release_Number="Not Applicable" />

    <UserDefined_MD/>
  </Meta_Data>
</File_Root>
